{
  "headline": "מראה קליל ואוורירי",
  "subhead": "מבנה רשת פתוח שמכניס עניין",
  "heroImage": "",
  "chip1": "",
  "chip2": "",
  "chip3": "",
  "insetImage": "",
  "insetLabel": "",
  "realMotionVideo": "",
  "audioFile": "",
  "caption": "יש פריטים שלא צריכים הרבה כדי למשוך את העין. 🤍\nהאייל הדקורטיבי הזה מביא איתו מראה קליל ואוורירי, עם מבנה רשת פתוח שמכניס עניין גם בלי להעמיס על החלל.\n\nעל מדף, בנישה או כחלק מפינה מעוצבת - הוא פשוט משתלב ונותן את הטאץ' הקטן שעושה הבדל.\n\n#VelvetFactory #עיצובלבית #דקורציהלבית #עיצובפנים #הדפסתתלתממד #3DPrinting #HomeDecor",
  "sourcePermalink": "https://www.instagram.com/p/DdosGbRia0T/",
  "sourceMediaId": "18129183877750390",
  "variablesStatus": "needs_input",
  "neededInputs": "text_free_master;real_motion_beat;approved_audio",
  "cta": "לפרטים והזמנות — שלחו לנו הודעה כאן באינסטגרם",
  "accentId": "light_gold",
  "accentHex": "#f8c888",
  "accentSource": "brand-tokens sampled from published deer post 2026-09-23"
}
